{
  "id": "gimp-basics-05-export-web",
  "app": "gimp",
  "title": "Export an image as JPG",
  "summary": "Write a JPG copy for the web with File, Export As.",
  "level": "beginner",
  "minutes": 4,
  "prereqs": ["gimp-basics-01-crop-scale"],
  "appVersion": ">=3.0",
  "tags": ["export"],
  "steps": [
    {
      "id": "check-image-open",
      "say": "Open a photo with Control O, or check that one is already showing in the middle.",
      "target": {
        "region": "canvas"
      },
      "expect": {
        "type": "user-action",
        "check": {
          "type": "anyOf",
          "checks": [
            {
              "type": "window-title",
              "regex": "\\d+x\\d+ – GIMP$"
            },
            {
              "type": "vision",
              "prompt": "Is an image open and visible in the middle of the GIMP window?"
            }
          ]
        }
      },
      "hints": [
        "Use File, then Open, and pick any JPG from your Pictures folder.",
        "Dragging a photo file onto the GIMP window opens it too."
      ],
      "why": "Every edit needs an open image to act on."
    },
    {
      "id": "open-export",
      "say": "Press Control Shift E to open Export Image.",
      "target": {
        "shortcut": "Ctrl+Shift+E"
      },
      "expect": {
        "type": "user-action",
        "check": {
          "type": "anyOf",
          "checks": [
            {
              "type": "window-title",
              "regex": "^Export Image"
            },
            {
              "type": "uia-event",
              "event": "window-opened",
              "match": {
                "name": "Export Image"
              }
            },
            {
              "type": "vision",
              "prompt": "Is a file dialog titled Export Image open?"
            }
          ]
        }
      },
      "hints": [
        "It is in the File menu, called Export As.",
        "Click on the image first so GIMP has focus, then press the keys."
      ],
      "why": "Export is how GIMP makes JPG or PNG files; Save only writes XCF.",
      "doItForMe": {
        "actions": [
          {
            "t": "keys",
            "combo": "Ctrl+Shift+E"
          }
        ]
      }
    },
    {
      "id": "set-name",
      "say": "In the Name box, type a name ending in .jpg, such as photo.jpg.",
      "target": {
        "element": {
          "name": "Name"
        }
      },
      "expect": {
        "type": "user-action",
        "check": {
          "type": "anyOf",
          "checks": [
            {
              "type": "vision",
              "prompt": "Does the Name box end with .jpg?"
            },
            {
              "type": "manual"
            }
          ]
        }
      },
      "hints": [
        "GIMP picks the file type from the ending of the name.",
        "Use .png instead if your image has see-through areas."
      ],
      "why": "The ending tells GIMP which format to write."
    },
    {
      "id": "pick-folder",
      "say": "Pick a folder in the list on the left, such as Pictures.",
      "target": null,
      "expect": {
        "type": "user-action",
        "check": {
          "type": "manual"
        }
      },
      "hints": [
        "Say done when the folder is chosen.",
        "Desktop is fine too if you want to find it fast."
      ],
      "why": "Choosing a known folder means you will find the file again later."
    },
    {
      "id": "click-export",
      "say": "Click Export.",
      "target": {
        "element": {
          "name": "Export",
          "role": "Button"
        }
      },
      "expect": {
        "type": "user-action",
        "check": {
          "type": "anyOf",
          "checks": [
            {
              "type": "window-title",
              "regex": "as JPEG"
            },
            {
              "type": "vision",
              "prompt": "Is a second dialog open with a Quality slider for JPEG?"
            }
          ]
        }
      },
      "hints": [
        "The Export button is at the bottom right of the dialog.",
        "Press Enter to click it from the keyboard."
      ],
      "why": "GIMP asks for format settings next."
    },
    {
      "id": "set-quality",
      "say": "Set Quality to about 85, then click Export.",
      "target": {
        "text": "Quality"
      },
      "expect": {
        "type": "user-action",
        "check": {
          "type": "anyOf",
          "checks": [
            {
              "type": "window-title",
              "regex": "\\(exported\\)"
            },
            {
              "type": "window-title",
              "regex": "– GIMP$"
            },
            {
              "type": "vision",
              "prompt": "Have the export dialogs closed, leaving the main GIMP window?"
            }
          ]
        }
      },
      "hints": [
        "Lower quality gives a smaller file with more blur and blocks.",
        "Tick Show preview in image window to see the effect first."
      ],
      "why": "Quality around 85 keeps photos sharp at a sensible file size."
    }
  ]
}
